{
  "acceptance": {
    "limitations": [
      "Engine proof flags apply only to the declared scope and assessed coverage.",
      "Synthetic PASS does not establish full Week 4 or SEAMLESS acceptance.",
      "Graph binding digest is not authentication of snapshot fact evidence.",
      "Prerequisite hashes record bytes; they do not verify raw-to-snapshot lineage.",
      "Attempt diagnostics have no branch ID in the current engine API.",
      "Explicit {} initial state is rejected; use {\"control\": []} for empty state."
    ],
    "pending_acceptance": [
      "#213 human review and CLI acceptance",
      "#208 independent exact-revision reproduction",
      "Actual private/SEAMLESS query reproduction"
    ],
    "resolved_dependencies": {
      "https://github.com/nairyuuu/ad-weighted-graph/pull/232": "merged"
    },
    "status": "experimental_pending_213_208"
  },
  "reproducibility": {
    "config_files": {
      "configs/attack_semantics.yml": "sha256:73d46a1d077870379e3fcc40ae5883acbb46e8160c86bb627b9dfc04a5d4d241",
      "configs/contract.yml": "sha256:f461e6e8d8d48b9841797da41ff9cee829b979148685f6a5185db66e23d79eea"
    },
    "effective_config_sha256": "sha256:6847967516559910bd818e782423e27f3dde55b15102335c42d3289238f8078b",
    "inputs": {
      "graph_input": {
        "reference": "tests/fixtures/rbcd/snapshot.json",
        "sha256": "sha256:5c9f400ab0a79bacd44a55fa87a73bd29a6fd530472ec3c4b8db94f3cc8ee005"
      },
      "query": {
        "reference": "tests/fixtures/rbcd/query-raw.json",
        "sha256": "sha256:0452a78f8ae4c3c0c5e13b77e655488ecfbac55e6e0f6bbed6384a8b0d25ee81"
      }
    },
    "revision": "6cf6328e11f68d263c782cf2094669c400a06cf7",
    "semantic_sha256": "sha256:8ec34616ca6e077cae97c7645565a959a0c3cbbd386f0305119356696f09ba15",
    "source_files": {
      "scripts/audit_seamless_raw.py": "sha256:2e3d251d0d5c27af9018e5102f302a870fcf2a17c3cf08f0382519726ff682a3",
      "scripts/audit_windows_telemetry_raw.py": "sha256:4a7123696ec52566656cfa2a6d093e1152775743abcd9f9c97ea4e3c241ef3ea",
      "scripts/bloodhound_baseline_audit.py": "sha256:bafc5cf631635d6bf8912ce26a45859726b85b5078509a45ea2b37951164ba7a",
      "scripts/check_contract.py": "sha256:2053b5c84c84350e2b5a2ec217e3385e73f72913be5c07d9523a2b55ad954173",
      "scripts/check_repository.py": "sha256:e6bbfe6f6a23c4ffb125914b38edaeb40b6a0f4ff19b5596306e0117756e31ef",
      "scripts/claim_traceability.py": "sha256:f42be1ac8fc8878b8df0d0286f3cbcf4fe3ff09e5ddb87595ac000ab2cb9b163",
      "scripts/eda_dataset_analysis.py": "sha256:f31b8d285e196c42844972b3f78e44d06611070a8fc505428915c6ce946610e5",
      "scripts/import_canonical_graph.py": "sha256:b96e66123c1832855cfc8a2e6b7a0ebf2be2de149811e8604f892b4a7018b731",
      "scripts/reconcile_graph_baseline.py": "sha256:3cffd94a75fba734ff270173b9c36a9ac7cbfd0874b3cc1901d94474914f8a16",
      "scripts/research/asrep_inputs.py": "sha256:7f790289de985688e2af75a425fea71fc7d5238d03d807e12291ab7be0f32aa4",
      "scripts/research/attack_scenarios.py": "sha256:a239623325ed3d01200384075d9015dbc233d19e829c20eb25ed4553bc265be6",
      "scripts/research/attack_scenarios_seamless.py": "sha256:f70ed608925ff53016fa81292eda9f337ee3a65daaa339a43c9bd62b9fd985e6",
      "scripts/research/check_week3_rating_policy.py": "sha256:96075cc6983e37f4063ebc2c7cbf6327c956d1fdafafe48d0f71a3c0be61fc11",
      "scripts/research/compare_group_identity_sets.py": "sha256:6ee47ab7615f06c4775fd702cea778d027813d7ba373689c6183935b3f783c1d",
      "scripts/research/compare_query_runs.py": "sha256:0c151f57b5c1f2f755301f4d32b89455886fee121814e45cad557d6c64199a62",
      "scripts/research/credential_bindings.py": "sha256:21bc3d8d98cb211fe66f7b45e0daed6d0406d798bb5fdd121a952dc47373269d",
      "scripts/research/export_legacy_reconciliation_baseline.py": "sha256:86476feb7097fbd6d5136f6b2224265823ce5fc3e5bbcfe1ccb7086fdb928b71",
      "scripts/research/field_screening_probe.py": "sha256:ad680ae79d1f30c307879f471cc55fb79ac5c21ce82bb882998c158fc81329fa",
      "scripts/research/kerberoasting_probe.py": "sha256:2595ed5beb22bf3f526b9fbb0d9c2d207474fdb572bc25288a14abbfb85a323b",
      "scripts/research/path_ranking_wire_adapter.py": "sha256:92f479e6eede12e5964b820bc73b67333cd50532f764ff4007cba98393374999",
      "scripts/research/raw_path_probe.py": "sha256:4ce85c6e5aebbdac3344d249aae2fc33968806061b072685cb9800f21186645a",
      "scripts/research/rbcd_inputs.py": "sha256:04a6034233e7f67c9788e976500ce4a646bacb7a6b909221131b8aa4a4176b78",
      "scripts/research/reconcile_rating_sheets.py": "sha256:6aeab687960158165346c724b43c3b084068765d230c9104181e0cafcc69d028",
      "scripts/research/reconcile_seamless_legacy.py": "sha256:602244bf3e47a7196f20bdfd46fa9f7bc0586f2036c8914b6c73add73e69440c",
      "scripts/research/reproduce_legacy_reconciliation.py": "sha256:57de62a3119dbc1aa081d78631402b12dca2e5bfca7a283d649674f1f29f9b12",
      "scripts/research/reproduce_seamless_legacy.py": "sha256:1f2bbf0023adc2d1402f330e6f56b6f246152ef82f9c16f1e6f1172a9d682cd2",
      "scripts/research/reviewed_parameter_release.py": "sha256:03d48f4332f5f80c337d66ce39984f892eb23ca4ddc8cfd2101b3ce91ec1f960",
      "scripts/research/seamless_packet_evidence.py": "sha256:1aab10a83c9cee7e30cdd1272b60e5a8b2ea24444381512b2c7e640b29f0dbd0",
      "scripts/research/seamless_parameter_validation.py": "sha256:0e97ca37c72500db9ff98046e91b486d1cbe0db2ed248f2238fc44a915dddff0",
      "scripts/research/semantics_probe.py": "sha256:45be9d25106b6e862ebb73f528304dc64159c99d32ed4434020cea320bcbd052",
      "scripts/research/snapshot_facts_probe.py": "sha256:ab2657d6f2b2e60f1a52120eaaeb56519767d1b9d94f2ab5d7645e701cfb3822",
      "scripts/research/synthetic_reviewed_release_demo.py": "sha256:f4a10ea890e08cc9e92ca64fd8c4023a4cb9d249fa811af23e1009693cd63f67",
      "scripts/research/trace_project_raw_locator.py": "sha256:24eec687a9ba585d2f97855cfdaafd2319607bd1bb5aa01cc48fc05daf66af65",
      "scripts/research/week3_engine_acceptance.py": "sha256:137aedb58e28b4728658a1372de03d60913526b8922fe8c2c819813ec027895b",
      "scripts/research/week3_semantic_bridge_probe.py": "sha256:d1ebb68e4af64079e5d54eb3ec48af332169b1b4bd192840a0c2e66b65a9adae",
      "scripts/research/week4_acceptance_runner.py": "sha256:e58041d30dce904a66767c98d35d850820732e3f1bc610524f7f5e21297ba8dd",
      "scripts/research/week4_cli_acceptance.py": "sha256:367b93cf8c120169615d78fbe6942b797d6ab1c73dc376d25beaf75a5b846788",
      "scripts/research/week4_scoring_eval.py": "sha256:490037ed9258246f5ef07a4bc8f66ea65e2a5a1e31eed6308e3539d814820207",
      "scripts/research/worked_example_validation.py": "sha256:fd860d21aaca2d7a938b2e88b793c397ed91c40fb0fa91450b3d8675fb8f169c",
      "scripts/run_bloodhound_baseline.py": "sha256:0381716d48a84b984f90b4006f0631781d3f3cc9c5077523406796cf19de3d2b",
      "scripts/snapshot_manifest.py": "sha256:8d59facc2021d52b9b0d54e3ec8c2a49d6eee2b2f845911f3b321fdccb2ab421",
      "scripts/verify_data_inventory.py": "sha256:cf14e19c2da1e508a7fb9eb216f78a528b3c1d54feaac6dea29399e4f58fddb0",
      "src/__init__.py": "sha256:be6500a9bf29b09aa81cb84abe1bca4424a106eb9303a4d116d4b7ec4cf4fe44",
      "src/data/__init__.py": "sha256:7c416fe27da09eedffab1061c88ad906230c2f045f6943ea6fd9e56a457ae495",
      "src/data/manifest.py": "sha256:1833056b49caf578e2728c51a4dd4603ff999bb4abe6c58f720357f7031ef192",
      "src/engine/__init__.py": "sha256:7804a717398aa102d3677ec4e2690c1118e5e2c0cb5cf5d75d55e6920b8aa996",
      "src/engine/graph.py": "sha256:df1f043927e2dedbef97a1b7cea937dff5c6165893cbef47ecf29332bff827e5",
      "src/engine/query.py": "sha256:ff77237772df78afea22034519709bb2faba31dee900f7a83c5a34a13cb3f89d",
      "src/engine/query_cli.py": "sha256:43b47e19de80137fb6a5de40f2c841160e230e3474da06cf2424948387cc1638",
      "src/engine/ranking/__init__.py": "sha256:6995963b8df9aa2f5c44f7f7d9996039d31965301fb3a1dba96202e411f8a6d9",
      "src/engine/ranking/adapter_145.py": "sha256:cc50a758053509766d0fa52316436aff9d9e49529aa5a1215ea374c77da34908",
      "src/engine/ranking/assessment.py": "sha256:dd46fafa1995e907c4cd562257f0e49067b293009995f6107cc285296f8b1d1f",
      "src/engine/ranking/cli.py": "sha256:b6717ec5bc2d50f406736ab8bac4b66280ecbb5f55c1abdcaf3ac38474a49e4f",
      "src/engine/ranking/facts.py": "sha256:476d434fb0adfe383d22a2e6577e37ad7cd5c0d4028e16e225e13a8a38047fd1",
      "src/engine/ranking/frontier.py": "sha256:06ff84f3db154dfaf04b5477443a16842232244b7a8badf1b05e5593507f2140",
      "src/engine/ranking/models.py": "sha256:936761b7e1f246f04fad4c36e8bd62ed2bc5d2fbf02f7cfae592f6d7eb144377",
      "src/engine/ranking/orchestration.py": "sha256:e5ee6b84420202d7556c61e597ef20247e9a04261218acc75fe12ad7cdbf6f40",
      "src/engine/ranking/replay.py": "sha256:6f4818305efe661f3fdee9da5b6ca75b9e79f127ec6cb293b6850c1ef1ee95b6",
      "src/engine/ranking/validation.py": "sha256:d62195f40c108aa19d954c86bfde4d8f4269661c7dcf72860c96d57202aa7f67",
      "src/engine/ranking/verification.py": "sha256:04f77d877bcee5cd51de68d5186a4d15b9e4b6f1c35716f29d76088a2e6d6261",
      "src/engine/search.py": "sha256:271279925982cee8191a94b218be93c1caa8d11022c259e139eadb0730823e10",
      "src/engine/semantics/__init__.py": "sha256:9fa8d5df674073e13ceab0b30d949894c20d62d7340ee34a00ecf80a3864ce0d",
      "src/engine/semantics/catalog.py": "sha256:a692efddfc4f05d29e4a3663cdf636efb30088bea4110d1d15d2fce6a7191e49",
      "src/engine/semantics/credentials.py": "sha256:fa8cefbb979e84fcc6ae7bd2ab44b785f3abeebe9e1601894e5175c4b803cc16",
      "src/engine/semantics/evaluator.py": "sha256:0d4dd143f8f608cd6ae29f5619aca7cc71f0e89b9b858561283d1c2368531a05",
      "src/engine/semantics/evidence_view.py": "sha256:a137bd9732dd049d011dc35dba7c27dfeebaf17476fd2c1cada0f7ce9a6fb41b",
      "src/engine/semantics/models.py": "sha256:3a7173803eb10918dcd96edb93ac73c25968c377b4370b0f5f7d3f7ddb9a5a59",
      "src/engine/semantics/projection_runtime.py": "sha256:b0f370a4dfde757b62a0d65761f492dcfb849be2567cd7a1a0dc5b35f719d91b",